{
  "build_cycle": "2025-11-09T05:30:15.789123Z",
  "findings_count": 11,
  "executive_summary": "## Executive Summary\n\nYour application has **11 security findings** across multiple categories:\n\n### By Severity\n- **Critical (2)**: Immediate attention required\n  - CVE-2021-44228 (Log4Shell): Remote code execution in Log4j\n  - CVE-2019-14234: SQL injection in Django\n- **High (5)**: High priority issues requiring prompt remediation\n  - Missing security controls (CSRF protection, privilege escalation)\n  - Kubernetes misconfigurations (read-only filesystem, liveness probes)\n- **Medium (3)**: Should be addressed in next sprint\n  - SQL injection risks in database queries\n  - Hardcoded credentials\n  - Security context misconfigurations\n- **Low (1)**: Minor issues that can be addressed over time\n  - Hardcoded password detection\n\n### By Category\n- **Dependency vulnerabilities (2)**: Outdated libraries with known CVEs\n- **Compliance issues (2)**: Kubernetes security policy violations\n- **SAST findings (5)**: Code-level security issues\n  - Command injection vulnerabilities\n  - SQL injection risks\n  - Missing CSRF protection\n  - Hardcoded credentials\n\n### Priority Actions\n\n1. **Critical - Immediate (Today)**\n   - Update Log4j to version 2.17.1 or later\n   - Update Django to version 1.11.23 or later\n   - Estimated time: 2-4 hours\n\n2. **High Priority (This Week)**\n   - Implement CSRF protection in Express application\n   - Fix command injection vulnerability in execute.py\n   - Configure Kubernetes security contexts\n   - Estimated time: 1-2 days\n\n3. **Medium Priority (Next Sprint)**\n   - Remediate SQL injection vulnerability in database.py\n   - Remove hardcoded credentials from config files\n   - Estimated time: 1 day\n\n### Recommendations\n\n- Implement automated dependency scanning in CI/CD pipeline\n- Enable security linting tools (Semgrep, Bandit) in pre-commit hooks\n- Conduct security training for development team on common vulnerabilities\n- Establish regular security review cadence (weekly/bi-weekly)\n\n**Total estimated remediation time**: 3-5 days across the team",
  "ai_provider": "anthropic",
  "ai_model": "claude-sonnet-4-5-20250929",
  "triage": {
    "clusters": [
      {
        "name": "Critical Dependency Vulnerabilities",
        "count": 2,
        "severity": "CRITICAL",
        "findings": [0, 1]
      },
      {
        "name": "Application Security Controls",
        "count": 3,
        "severity": "HIGH",
        "findings": [2, 3, 4]
      },
      {
        "name": "Kubernetes Security Configuration",
        "count": 3,
        "severity": "HIGH",
        "findings": [5, 6, 7]
      },
      {
        "name": "Code-level Injection Vulnerabilities",
        "count": 2,
        "severity": "MEDIUM",
        "findings": [8, 9]
      },
      {
        "name": "Credential Management",
        "count": 1,
        "severity": "LOW",
        "findings": [10]
      }
    ],
    "cluster_count": 5,
    "total_findings": 11,
    "ai_analysis": "## Triage Analysis\n\nI've organized your 11 security findings into 5 distinct clusters based on their nature, impact, and remediation approach.\n\n---\n\n### ðŸ”´ Priority 1: Critical Dependency Vulnerabilities (2 findings)\n\n**Cluster:** CVE-based dependency vulnerabilities requiring immediate updates\n\n**Findings:**\n- CVE-2021-44228 (Log4Shell) in log4j-core 2.14.0\n- CVE-2019-14234 (SQL Injection) in Django 1.11.0\n\n**Impact:** CRITICAL\n- Remote code execution (Log4Shell)\n- SQL injection leading to data breach (Django)\n- Both are well-known, actively exploited vulnerabilities\n\n**Remediation Effort:** 2-4 hours\n\n**Action Plan:**\n1. Update `pom.xml` to use log4j-core 2.17.1+\n2. Update `requirements.txt` to use Django 1.11.23+\n3. Run dependency install and rebuild\n4. Deploy to production immediately\n5. Test application functionality\n\n**Why prioritize:** These are publicly disclosed CVEs with known exploits. Attackers actively scan for these vulnerabilities.\n\n---\n\n### ðŸŸ  Priority 2: Application Security Controls (3 findings)\n\n**Cluster:** Missing or misconfigured application-level security controls\n\n**Findings:**\n- Missing CSRF protection (Express/JavaScript)\n- Dangerous shell command execution (Python subprocess)\n- Privilege escalation risk (Kubernetes)\n\n**Impact:** HIGH\n- CSRF: Session hijacking, unauthorized actions\n- Command injection: Remote code execution\n- Privilege escalation: Container breakout\n\n**Remediation Effort:** 1 day\n\n**Action Plan:**\n1. Install and configure `csurf` middleware in Express app\n2. Refactor `execute.py` to avoid `shell=True` and use argument lists\n3. Add `allowPrivilegeEscalation: false` to Kubernetes security contexts\n4. Test each fix thoroughly\n\n**Why prioritize:** These are fundamental security controls. Their absence creates attack vectors across multiple layers.\n\n---\n\n### ðŸŸ¡ Priority 3: Kubernetes Security Configuration (3 findings)\n\n**Cluster:** Kubernetes deployment configuration issues\n\n**Findings:**\n- Root filesystem not read-only (KSV014)\n- Missing liveness probe (CKV_K8S_8)\n- Privilege escalation allowed (CKV_K8S_20)\n\n**Impact:** HIGH (security) / MEDIUM (availability)\n- Increased attack surface for container compromise\n- Reduced reliability (no health checks)\n\n**Remediation Effort:** 4-6 hours\n\n**Action Plan:**\n1. Update `k8s/deployment.yaml` with security contexts:\n   ```yaml\n   securityContext:\n     readOnlyRootFilesystem: true\n     allowPrivilegeEscalation: false\n     runAsNonRoot: true\n   ```\n2. Add liveness and readiness probes\n3. Add emptyDir volumes for writable paths (/tmp, /cache)\n4. Test deployment in staging\n5. Roll out to production\n\n**Why prioritize:** Defense in depth for container security. If application is compromised, these controls limit damage.\n\n---\n\n### ðŸŸ¢ Priority 4: Code-level Injection Vulnerabilities (2 findings)\n\n**Cluster:** SQL injection risks in application code\n\n**Findings:**\n- String-based SQL query construction (database.py)\n- Command injection via shell=True (execute.py - duplicate from Priority 2)\n\n**Impact:** MEDIUM\n- Potential for SQL injection if user input reaches these code paths\n- Requires specific attack conditions\n\n**Remediation Effort:** 4 hours\n\n**Action Plan:**\n1. Refactor `database.py` to use parameterized queries\n2. Review all database query construction patterns\n3. Add input validation and sanitization\n4. Consider using an ORM (SQLAlchemy) for safer database access\n\n**Why prioritize:** While serious, these require attacker to control input to specific code paths. Fix after addressing direct vulnerabilities.\n\n---\n\n### âšª Priority 5: Credential Management (1 finding)\n\n**Cluster:** Hardcoded credentials and secrets management\n\n**Findings:**\n- Possible hardcoded password in config.py\n\n**Impact:** LOW (if credentials are test/dummy) to HIGH (if production)\n- Depends on whether these are actual production credentials\n- Risk of credential leak via source control\n\n**Remediation Effort:** 2 hours\n\n**Action Plan:**\n1. Move credentials to environment variables\n2. Use `.env` files (excluded from git)\n3. Consider using secrets management (AWS Secrets Manager, HashiCorp Vault)\n4. Rotate any credentials that were previously hardcoded\n5. Audit git history for leaked credentials\n\n**Why prioritize last:** Address after fixing active vulnerabilities, but ensure hardcoded credentials aren't production secrets.\n\n---\n\n## Summary\n\n**Total remediation time:** 3-5 days (distributed across team)\n\n**Recommended order:**\n1. Day 1 (Critical): Fix dependency CVEs â†’ Deploy to production\n2. Day 2 (High): Add CSRF protection, fix command injection\n3. Day 3 (High): Configure Kubernetes security contexts\n4. Day 4 (Medium): Fix SQL injection vulnerabilities\n5. Day 5 (Low): Move credentials to environment variables\n\n**Long-term recommendations:**\n- Set up automated dependency scanning (Dependabot, Renovate)\n- Add security scanning to CI/CD pipeline\n- Implement pre-commit hooks with Semgrep/Bandit\n- Conduct regular security training for developers",
    "ai_provider": "anthropic",
    "ai_model": "claude-sonnet-4-5-20250929"
  }
}
